{
  "schemaVersion": "1.0.0",
  "catalogId": "gemuera.m0.instruction-flag-resolution",
  "catalogVersion": "1.0.0",
  "sourceWorkPackage": "M0-DIA-03",
  "sourceDescriptorSetHash": "d347bdd7bfbff61ee11504b30e5d5acaa1ab4c7a04482ac272f8db6115ba2fa9",
  "sourceInstructionSignatureResolutionHash": "2f9995f8630142a584767054d1f9ad4f7bef51a343e51654e1407d90845e80e2",
  "knownFlags": ["DEBUG_FUNC", "EXTENDED", "FLOW_CONTROL", "FORCE_SETARG", "ISPRINTDFUNC", "ISPRINTKFUNC", "IS_INPUT", "IS_JUMP", "IS_PRINT", "IS_PRINTDATA", "IS_TRY", "IS_TRYC", "METHOD_SAFE", "PARTIAL", "PRINT_NEWLINE", "PRINT_SINGLE", "PRINT_WAITINPUT"],
  "rules": [
    {"ruleId":"await.active","handlerType":"AWAIT_Instruction","matchKind":"Exact","pattern":"AWAIT","selectedHandlerFlags":["EXTENDED"],"expectedMatchCount":1,"rationale":"活动构造赋值仅为 EXTENDED；IS_PRINT/IS_INPUT 位于注释。"},
    {"ruleId":"call.base","handlerType":"CALL_Instruction","matchKind":"PublicKeyRegex","pattern":"^.*$","selectedHandlerFlags":["FLOW_CONTROL","FORCE_SETARG"],"expectedMatchCount":12,"rationale":"CALL 构造器基础 flags。"},
    {"ruleId":"call.jump","handlerType":"CALL_Instruction","matchKind":"PublicKeyRegex","pattern":"^.*JUMP.*$","selectedHandlerFlags":["IS_JUMP"],"expectedMatchCount":6,"rationale":"isJump=true。"},
    {"ruleId":"call.try","handlerType":"CALL_Instruction","matchKind":"PublicKeyRegex","pattern":"^TRY.*$","selectedHandlerFlags":["IS_TRY"],"expectedMatchCount":8,"rationale":"isTry=true。"},
    {"ruleId":"call.try-catch","handlerType":"CALL_Instruction","matchKind":"PublicKeyRegex","pattern":"^TRYC(?:CALL|JUMP).*$","selectedHandlerFlags":["IS_TRYC","PARTIAL"],"expectedMatchCount":4,"rationale":"isTryCatch=true；TRYCALL 不是 TRY-CATCH。"},
    {"ruleId":"callf.base","handlerType":"CALLF_Instruction","matchKind":"PublicKeyRegex","pattern":"^.*$","selectedHandlerFlags":["EXTENDED","METHOD_SAFE","FORCE_SETARG"],"expectedMatchCount":4,"rationale":"CALLF 构造器基础 flags。"},
    {"ruleId":"callf.try","handlerType":"CALLF_Instruction","matchKind":"PublicKeyRegex","pattern":"^TRY.*$","selectedHandlerFlags":["IS_TRY"],"expectedMatchCount":2,"rationale":"TRYCALLF 变体 isTry=true。"},
    {"ruleId":"calls.base","handlerType":"CALLS_Instruction","matchKind":"PublicKeyRegex","pattern":"^.*$","selectedHandlerFlags":["FLOW_CONTROL","FORCE_SETARG"],"expectedMatchCount":6,"rationale":"CALLS 构造器基础 flags。"},
    {"ruleId":"calls.jump","handlerType":"CALLS_Instruction","matchKind":"PublicKeyRegex","pattern":"^.*JUMP.*$","selectedHandlerFlags":["IS_JUMP"],"expectedMatchCount":3,"rationale":"isJump=true。"},
    {"ruleId":"calls.try","handlerType":"CALLS_Instruction","matchKind":"PublicKeyRegex","pattern":"^TRY.*$","selectedHandlerFlags":["IS_TRY"],"expectedMatchCount":4,"rationale":"isTry=true。"},
    {"ruleId":"calls.try-catch","handlerType":"CALLS_Instruction","matchKind":"PublicKeyRegex","pattern":"^TRYC(?:CALL|JUMP)STR$","selectedHandlerFlags":["IS_TRYC","PARTIAL"],"expectedMatchCount":2,"rationale":"字符串 TRY-CATCH 变体。"},
    {"ruleId":"debugprint.base","handlerType":"DEBUGPRINT_Instruction","matchKind":"PublicKeyRegex","pattern":"^.*$","selectedHandlerFlags":["METHOD_SAFE","EXTENDED","DEBUG_FUNC"],"expectedMatchCount":4,"rationale":"DEBUGPRINT 构造器基础 flags。"},
    {"ruleId":"debugprint.newline","handlerType":"DEBUGPRINT_Instruction","matchKind":"PublicKeyRegex","pattern":"^.*L$","selectedHandlerFlags":["PRINT_NEWLINE"],"expectedMatchCount":2,"rationale":"newline=true。"},
    {"ruleId":"goto.base","handlerType":"GOTO_Instruction","matchKind":"PublicKeyRegex","pattern":"^.*$","selectedHandlerFlags":["METHOD_SAFE","FLOW_CONTROL","FORCE_SETARG"],"expectedMatchCount":6,"rationale":"GOTO 构造器基础 flags。"},
    {"ruleId":"goto.try","handlerType":"GOTO_Instruction","matchKind":"PublicKeyRegex","pattern":"^TRY.*$","selectedHandlerFlags":["IS_TRY"],"expectedMatchCount":4,"rationale":"isTry=true。"},
    {"ruleId":"goto.try-catch","handlerType":"GOTO_Instruction","matchKind":"PublicKeyRegex","pattern":"^TRYCGOTO.*$","selectedHandlerFlags":["IS_TRYC","PARTIAL"],"expectedMatchCount":2,"rationale":"isTryCatch=true。"},
    {"ruleId":"inputmousekey.active","handlerType":"INPUTMOUSEKEY_Instruction","matchKind":"Exact","pattern":"INPUTMOUSEKEY","selectedHandlerFlags":["EXTENDED"],"expectedMatchCount":1,"rationale":"活动构造赋值仅为 EXTENDED；输入 flags 位于注释。"},
    {"ruleId":"print.base","handlerType":"PRINT_Instruction","matchKind":"PublicKeyRegex","pattern":"^PRINT.*$","selectedHandlerFlags":["IS_PRINT"],"expectedMatchCount":77,"rationale":"全部 PRINT 基础 flag。"},
    {"ruleId":"print.d","handlerType":"PRINT_Instruction","matchKind":"PublicKeyRegex","pattern":"^PRINT.*D.*$","selectedHandlerFlags":["ISPRINTDFUNC","EXTENDED"],"expectedMatchCount":24,"rationale":"D 变体。"},
    {"ruleId":"print.form-c","handlerType":"PRINT_Instruction","matchKind":"Exact","pattern":"PRINTFORMC","selectedHandlerFlags":["EXTENDED"],"expectedMatchCount":1,"rationale":"PRINTFORMC 特例。"},
    {"ruleId":"print.k","handlerType":"PRINT_Instruction","matchKind":"PublicKeyRegex","pattern":"^PRINT.*K.*$","selectedHandlerFlags":["ISPRINTKFUNC","EXTENDED"],"expectedMatchCount":24,"rationale":"K 变体。"},
    {"ruleId":"print.lc","handlerType":"PRINT_Instruction","matchKind":"PublicKeyRegex","pattern":"^PRINT(?:FORM)?LC.*$","selectedHandlerFlags":["EXTENDED"],"expectedMatchCount":6,"rationale":"LC 变体。"},
    {"ruleId":"print.method-safe","handlerType":"PRINT_Instruction","matchKind":"PublicKeyRegex","pattern":"^PRINT.*(?<![NW])$","selectedHandlerFlags":["METHOD_SAFE"],"expectedMatchCount":57,"rationale":"非 N/W 变体为 METHOD_SAFE。"},
    {"ruleId":"print.newline","handlerType":"PRINT_Instruction","matchKind":"PublicKeyRegex","pattern":"^PRINT.*[LW]$","selectedHandlerFlags":["PRINT_NEWLINE"],"expectedMatchCount":30,"rationale":"L/W 变体换行。"},
    {"ruleId":"print.single","handlerType":"PRINT_Instruction","matchKind":"PublicKeyRegex","pattern":"^PRINTSINGLE.*$","selectedHandlerFlags":["PRINT_SINGLE","EXTENDED"],"expectedMatchCount":15,"rationale":"SINGLE 变体。"},
    {"ruleId":"print.wait","handlerType":"PRINT_Instruction","matchKind":"PublicKeyRegex","pattern":"^PRINT.*[NW]$","selectedHandlerFlags":["PRINT_WAITINPUT"],"expectedMatchCount":20,"rationale":"N/W 变体等待输入。"},
    {"ruleId":"printdata.base","handlerType":"PRINT_DATA_Instruction","matchKind":"PublicKeyRegex","pattern":"^PRINTDATA.*$","selectedHandlerFlags":["EXTENDED","IS_PRINT","IS_PRINTDATA","PARTIAL"],"expectedMatchCount":9,"rationale":"全部 PRINTDATA 基础 flags。"},
    {"ruleId":"printdata.d","handlerType":"PRINT_DATA_Instruction","matchKind":"PublicKeyRegex","pattern":"^PRINTDATA(?:K)?D(?:L|W)?$","selectedHandlerFlags":["ISPRINTDFUNC","EXTENDED"],"expectedMatchCount":3,"rationale":"PRINTDATA D 变体。"},
    {"ruleId":"printdata.k","handlerType":"PRINT_DATA_Instruction","matchKind":"PublicKeyRegex","pattern":"^PRINTDATAK(?:D)?(?:L|W)?$","selectedHandlerFlags":["ISPRINTKFUNC","EXTENDED"],"expectedMatchCount":3,"rationale":"PRINTDATA K 变体。"},
    {"ruleId":"printdata.method-safe","handlerType":"PRINT_DATA_Instruction","matchKind":"PublicKeyRegex","pattern":"^PRINTDATA.*(?<!W)$","selectedHandlerFlags":["METHOD_SAFE"],"expectedMatchCount":6,"rationale":"非 W 变体为 METHOD_SAFE。"},
    {"ruleId":"printdata.newline","handlerType":"PRINT_DATA_Instruction","matchKind":"PublicKeyRegex","pattern":"^PRINTDATA.*[LW]$","selectedHandlerFlags":["PRINT_NEWLINE"],"expectedMatchCount":6,"rationale":"L/W 变体换行。"},
    {"ruleId":"printdata.wait","handlerType":"PRINT_DATA_Instruction","matchKind":"PublicKeyRegex","pattern":"^PRINTDATA.*W$","selectedHandlerFlags":["PRINT_WAITINPUT"],"expectedMatchCount":3,"rationale":"W 变体等待输入。"},
    {"ruleId":"repeat.base","handlerType":"REPEAT_Instruction","matchKind":"PublicKeyRegex","pattern":"^.*$","selectedHandlerFlags":["METHOD_SAFE","FLOW_CONTROL","PARTIAL"],"expectedMatchCount":2,"rationale":"REPEAT/FOR 基础 flags。"},
    {"ruleId":"repeat.for","handlerType":"REPEAT_Instruction","matchKind":"Exact","pattern":"FOR","selectedHandlerFlags":["EXTENDED"],"expectedMatchCount":1,"rationale":"FOR 变体扩展 flag。"},
    {"ruleId":"twait.active","handlerType":"TWAIT_Instruction","matchKind":"Exact","pattern":"TWAIT","selectedHandlerFlags":["IS_PRINT","EXTENDED"],"expectedMatchCount":1,"rationale":"构造器 flags；DoInstruction 的局部 flag 不属于 descriptor。"}
  ]
}
